<Payload xmlns="http://javaops.ru"
         xmlns:xsi="http://www.w3.org/2001/XMLSchema-instance"
         xsi:schemaLocation="http://javaops.ru payload.xsd">
    <Users>
        <User id="u1" flag="active" city="kiv" email="gmail@gmail.com">
            <fullName>Full Name</fullName>
        </User>
        <User id="u2" flag="superuser" city="spb" email="admin@javaops.ru">
            <fullName>Admin</fullName>
        </User>
        <User id="u3" flag="deleted" city="spb" email="mail@yandex.ru">
            <fullName>Deleted</fullName>
        </User>
    </Users>
    <Cities>
        <City id="spb">Санкт-Петербург</City>
        <City id="kiv">Киев</City>
        <City id="mnsk">Минск</City>
    </Cities>
    <Projects>
        <Project name="Spring Basics">
            <Group name="Spring Core" type="CURRENT">
                <Participant user="u1"/>
                <Participant user="u2"/>
            </Group>
            <Group name="Spring Boot" type="REGISTERING">
                <Participant user="u2"/>
                <Participant user="u3"/>
            </Group>
            <Group name="Spring Data" type="FINISHED">
                <Participant user="u1"/>
                <Participant user="u2"/>
                <Participant user="u3"/>
            </Group>
        </Project>
    </Projects>
</Payload>